{
  "implementationSHA256": "bf8dea05e7b6dbf726d0a857d2e9f78219bf28c24a949c8a93f21891eac83d56",
  "normativeFiles": [
    {
      "bytes": 47957,
      "path": "BenchmarkCore/corelm_benchmark.py",
      "sha256": "9c689ce190dadd2373be7c4192b5a998ca9dd3815eeffaf0cdb85a4a21f8c6b5"
    },
    {
      "bytes": 12081,
      "path": "RealLLM/BEACON_HELDOUT_PROTOCOL.md",
      "sha256": "d5c5d87a7c8d55f329b1b78643f4dab46bc81de5b106f101ce54055777a94ab6"
    },
    {
      "bytes": 17487,
      "path": "RealLLM/beacon_evaluation.py",
      "sha256": "78d5b2f00633c2cc306a7a2e457dc5ea2f6ffff2cbbd6d7c1919667e8cd01881"
    },
    {
      "bytes": 53391,
      "path": "RealLLM/beacon_protocol.py",
      "sha256": "c6a6abfcf3535b5116fc83acda40e27489bca6723cc6477256d52f6d3b615e62"
    },
    {
      "bytes": 9804,
      "path": "RealLLM/beacon_registration.json",
      "sha256": "7c0cb4cf544773041be84e75de4314c72769c71682e1b138b99ea85996cc5779"
    },
    {
      "bytes": 4438,
      "path": "RealLLM/beacon_window_ledger.json",
      "sha256": "81e84d09682bb4beab5f42c8bd87179a874b879eaf6e6ca539723e54bbc75a83"
    },
    {
      "bytes": 67362,
      "path": "RealLLM/benchmark_real_llm.py",
      "sha256": "b5e7b301222501e148d54cda3f0d04997e6a061051cedc6393d1a87b638522d0"
    },
    {
      "bytes": 23987,
      "path": "RealLLM/codecs.py",
      "sha256": "fe5763b7cb0b2e775436c7414a1af48704095518e0428fe4a7965b84f0ce7a05"
    },
    {
      "bytes": 3905,
      "path": "RealLLM/prepare_beacon_assets.py",
      "sha256": "f621fa05d9c5d67bf913445b742249a4ac34229cd04d686ad91a8569b9fcfdba"
    },
    {
      "bytes": 4165,
      "path": "RealLLM/prepare_beacon_freeze.py",
      "sha256": "82103a903e3df361873d48d11fedc97357d8f56c44ce1cf6ff223c7ad65a6358"
    },
    {
      "bytes": 55781,
      "path": "RealLLM/requirements.lock",
      "sha256": "e731ab2076b171d731b42ee8609d5943954911a10c92564ab52b7bed7a9fa561"
    },
    {
      "bytes": 209,
      "path": "RealLLM/requirements.txt",
      "sha256": "3d6a28b4f811153a62fb009a2240feb0866bcabeaa1e9a45820fe9689a9b422d"
    },
    {
      "bytes": 21334,
      "path": "RealLLM/run_beacon_one_shot.py",
      "sha256": "3b3b7fbc529ac0310a7f88a87d848902f39586f47d8187f99cb2e4510fd0fbcf"
    },
    {
      "bytes": 8716,
      "path": "RealLLM/run_beacon_regression.py",
      "sha256": "eb88fa0376e855cde60b7d039ec136dd62d4116774e4218708c7a4719556eb60"
    },
    {
      "bytes": 54645,
      "path": "RealLLM/verify_beacon_evidence.py",
      "sha256": "9923c7ac7c2dd80fedd17e72f9c0b4d1dc8e7c00bda5c726a7792fb73f5d5005"
    },
    {
      "bytes": 35374,
      "path": "RealLLM/voidtoken_v5.py",
      "sha256": "80ed51aa2a201dbdaae36434709a50a8a679fa84d29b08ad7b083c14cec33758"
    },
    {
      "bytes": 2849,
      "path": "Tests/fixtures/nist-beacon-certificate-528943a5.pem",
      "sha256": "847bbfff2a1a842f07c2c5697e63a102d3cb7605559ec2da5cf8397ee0b5e9de"
    },
    {
      "bytes": 3902,
      "path": "Tests/fixtures/nist-beacon-chain-2-pulse-1884240.json",
      "sha256": "e863e887767370b4c7f05fca0d3cd22d8985ec456a97ffe00e4213dc86ae5754"
    },
    {
      "bytes": 32274,
      "path": "Tests/test_beacon_protocol.py",
      "sha256": "f8b0def0e3c8f479044cd72b73c9415a0e0238cb54f1cb80ea64e6e17603cfca"
    },
    {
      "bytes": 2848,
      "path": "schemas/beacon-attempt.schema.json",
      "sha256": "4f8e5659cd2ded04ce0f6f17f9a08556af368fb5045ebe7d035aa926322100f2"
    },
    {
      "bytes": 8013,
      "path": "schemas/beacon-freeze.schema.json",
      "sha256": "369f52b33225b42a1771f2dff8fd16359ce7f20c42e578203013836609a3b9f0"
    },
    {
      "bytes": 24225,
      "path": "schemas/beacon-outcome.schema.json",
      "sha256": "a97d35102d5794f9241c84ed2f3c58e2ec440fc919636dd9a1d201ee2a754d44"
    },
    {
      "bytes": 17345,
      "path": "schemas/beacon-registration.schema.json",
      "sha256": "70c474c069b8f4b76498372a659e40f4ae3374bc667e48b1037545c4b7d16fd2"
    },
    {
      "bytes": 8264,
      "path": "schemas/beacon-resolution.schema.json",
      "sha256": "a8d488fae9bdd8732894d463330468e6765c58ef1e76beef201857e162f76b50"
    },
    {
      "bytes": 7251,
      "path": "schemas/beacon-window-ledger.schema.json",
      "sha256": "057f131de072789d6d1ccd595eec85404717c9ae14a9671424bd671fbc76b217"
    },
    {
      "bytes": 32980,
      "path": "security/verify_primary_evidence.py",
      "sha256": "1b53af07ed7a718f28907307c71e60fe86495b9a08f7e49de8c3c6f4d7d86a89"
    }
  ],
  "preparedAt": "2026-08-01T01:09:03Z",
  "protocolCommit": "b34bc4d06c00c86b99076b117049e2d590d73bcd",
  "registrationArtifactSHA256": "7c0cb4cf544773041be84e75de4314c72769c71682e1b138b99ea85996cc5779",
  "registrationCanonicalSHA256": "ce4e1bf9b4bd90e8ca6bdb32279c9ff015bcc7a271fe4be1bcfc9c6b0ea38a4e",
  "schemaVersion": "corelm-beacon-freeze-v1",
  "status": "protocol-files-frozen-before-beacon",
  "suiteId": "qwen2.5-0.5b-kv-voidtoken-v5-beacon-heldout-v1",
  "windowLedgerSHA256": "81e84d09682bb4beab5f42c8bd87179a874b879eaf6e6ca539723e54bbc75a83"
}
